id,title,source,date,score,status,isVerified
78889990,น้ำมันจะขาดแคลนในอีก 24 ชั่วโมง,X,2026-02-08,95,ปกติ,true
34445556,ประกาศปิดโรงเรียนทั่วประเทศด่วน,TikTok,2026-02-04,90,ปกติ,false
12345678,ไวรัสสายพันธุ์ใหม่ระบาดหนัก,X,2026-02-02,85,ปกติ,false
56667778,ยกเลิกวันหยุดสงกรานต์ปีนี้,Facebook,2026-02-06,75,ปกติ,false
22223333,แจกเงินดิจิทัลรอบใหม่ 20000,Line,2026-02-03,50,ปกติ,false
67778889,ราคาไข่ไก่พุ่งสูงฟองละ 10 บาท,Line,2026-02-07,40,ปกติ,false
10000001,พบกลุ่มควันปริศนาใจกลางเมือง,Facebook,2026-02-01,15,ปกติ,true
45556667,พายุหิมะเตรียมตกในกรุงเทพฯ,YouTube,2026-02-05,5,ปกติ,false
99998888,ธนาคารประกาศระงับการถอนเงินชั่วคราว,Line,2026-02-09,88,ปกติ,false